IMDB_id,TMDB_id,Title,year,duration,Rating,Votes,Genres,Overview
,1239146,Woody Woodpecker Goes to Camp,2024,101,7.3,61,"Family, Comedy, Animation","After getting kicked out of the forest, Woody thinks he's found a forever home at Camp Woo Hoo — until an inspector threatens to shut down the camp."
,141,Donnie Darko,2001,114,7.8,11953,"Fantasy, Drama, Mystery","After narrowly escaping a bizarre accident, a troubled teenager is plagued by visions of a large bunny rabbit that manipulates him to commit a series of crimes."
,399170,Logan Lucky,2017,118,6.7,3346,"Comedy, Crime, Action, Drama","Trying to reverse a family curse, brothers Jimmy and Clyde Logan set out to execute an elaborate robbery during the legendary Coca-Cola 600 race at the Charlotte Motor Speedway."
,699280,Becoming,2020,89,7.4,145,Documentary,"Join former first lady Michelle Obama in an intimate documentary looking at her life, hopes and connection with others."
,637649,Wrath of Man,2021,119,7.6,4983,"Action, Crime, Thriller","A cold and mysterious new security guard for a Los Angeles cash truck company surprises his co-workers when he unleashes precision skills during a heist. The crew is left wondering who he is and where he came from. Soon, the marksman's ultimate motive becomes clear as he takes dramatic and irrevocable steps to settle a score."
,122917,The Hobbit: The Battle of the Five Armies,2014,144,7.3,13768,"Action, Adventure, Fantasy","Immediately after the events of The Desolation of Smaug, Bilbo and the dwarves try to defend Erebor's mountain of treasure from others who claim it: the men of the ruined Laketown and the elves of Mirkwood. Meanwhile an army of Orcs led by Azog the Defiler is marching on Erebor, fueled by the rise of the dark lord Sauron. Dwarves, elves and men must unite, and the hope for Middle-Earth falls into Bilbo's hands."
tt21261712,998846,Back to Black,2024,122,6.6,2325,"Biography, Drama, Music, Music, Drama","The life and music of Amy Winehouse, through the journey of adolescence to adulthood and the creation of one of the best-selling albums of our time."
,235,Stand by Me,1986,89,7.9,5598,"Crime, Drama","After learning that a boy their age has been accidentally killed near their rural homes, four Oregon boys decide to go see the body. On the way, Gordie,  Vern, Chris and Teddy encounter a mean junk man and a marsh full of leeches, as they also learn more about one another and their very different home lives. Just a lark at first, the boys' adventure evolves into a defining event in their lives."
,682075,The Adventure of A.R.I.: My Robot Friend,2022,89,7.3,9,"Family, Science Fiction",A teenager summons the courage to help a friendly robot known as A.R.I. kidnapped by a ruthless lab director working for a powerful corporation seeking to turn him into a dangerous weapon in order to rule the world.
,1029575,The Family Plan,2023,119,7.3,1131,"Action, Comedy","Dan Morgan is many things: a devoted husband, a loving father, a celebrated car salesman. He's also a former assassin. And when his past catches up to his present, he's forced to take his unsuspecting family on a road trip unlike any other."
,802219,Bob Marley: One Love,2024,104,7,491,"Music, History, Drama",Jamaican singer-songwriter Bob Marley overcomes adversity to become the most famous reggae musician in the world.
tt11540468,720321,Breathe,2024,93,4.4,740,"Action, Thriller, Science Fiction, Mystery, Thriller, Action","An East Flatbush mother and daughter, barely surviving in an oxygen-less world, must band together to protect each other when intruders arrive claiming to know their missing father."
tt8367814,,The Gentlemen,2019,113,7.8,398000,"Action, Crime","An American expat tries to sell off his highly profitable marijuana empire in London, triggering plots, schemes, bribery and blackmail in an attempt to steal his domain out from under him."
tt1745960,361743,Top Gun: Maverick,2022,130,8.2,702514,"Action, Drama, Action, Drama","After thirty years, Maverick is still pushing the envelope as a top naval aviator, but must confront ghosts of his past when he leads TOP GUN's elite graduates on a mission that demands the ultimate sacrifice from those chosen to fly it."
,951491,Saw X,2023,118,7.3,1654,"Horror, Thriller","Between the events of 'Saw' and 'Saw II', a sick and desperate John Kramer travels to Mexico for a risky and experimental medical procedure in hopes of a miracle cure for his cancer, only to discover the entire operation is a scam to defraud the most vulnerable. Armed with a newfound purpose, the infamous serial killer returns to his work, turning the tables on the con artists in his signature visceral way through devious, deranged, and ingenious traps."
,269149,Zootopia,2016,109,7.7,15770,"Animation, Adventure, Family, Comedy","Determined to prove herself, Officer Judy Hopps, the first bunny on Zootopia's police force, jumps at the chance to crack her first case - even if it means partnering with scam-artist fox Nick Wilde to solve the mystery."
,68730,Silence,2016,161,7.1,2946,"Drama, History","Two Jesuit priests travel to seventeenth century Japan which has, under the Tokugawa shogunate, banned Catholicism and almost all foreign contact."
,597891,Kate,2021,106,6.6,1405,Action,A ruthless criminal operative has less than 24 hours to exact revenge on her enemies and in the process forms an unexpected bond with the daughter of one of her past victims.
,862,Toy Story,1995,81,8,17780,"Animation, Adventure, Family, Comedy","Led by Woody, Andy's toys live happily in his room until Andy's birthday brings Buzz Lightyear onto the scene. Afraid of losing his place in Andy's heart, Woody plots against Buzz. But when circumstances separate Buzz and Woody from their owner, the duo eventually learns to put aside their differences."
,863,Toy Story 2,1999,92,7.6,13363,"Animation, Comedy, Family","Andy heads off to Cowboy Camp, leaving his toys to their own devices. Things shift into high gear when an obsessive toy collector named Al McWhiggen, owner of Al's Toy Barn kidnaps Woody. Andy's toys mount a daring rescue mission, Buzz Lightyear meets his match and Woody has to decide where he and his heart truly belong."
,845111,The Three Musketeers: Milady,2023,121,6.6,293,"Adventure, Action, Drama","D'Artagnan, on a quest to rescue the abducted Constance, runs into the mysterious Milady de Winter again. The tension between the Catholics and the Protestants finally escalates, as the king declares war — forcing the now four musketeers into battle. But as the war goes on, they are tested physically, mentally and emotionally."
,1075794,Leo,2023,102,7.5,1042,"Animation, Comedy, Family","Jaded 74-year-old lizard Leo has been stuck in the same Florida classroom for decades with his terrarium-mate turtle. When he learns he only has one year left to live, he plans to escape to experience life on the outside but instead gets caught up in the problems of his anxious students — including an impossibly mean substitute teacher."
,395990,Death Wish,2018,107,6.2,2455,"Action, Crime, Drama, Thriller",A mild-mannered father is transformed into a killing machine after his family is torn apart by a violent act.
tt0075005,794,The Omen,1976,111,7.5,133946,"Horror, Mystery, Horror, Thriller",Mysterious deaths surround an American ambassador. Could the child that he is raising actually be the Antichrist? The Devil's own son?
,1212073,Sixty Minutes,2024,89,6.8,467,Action,"Desperate to keep custody of his daughter, a mixed martial arts fighter abandons a big match and races across Berlin to attend her birthday party."
,315635,Spider-Man: Homecoming,2017,133,7.3,21135,"Action, Adventure, Science Fiction, Drama","Following the events of Captain America: Civil War, Peter Parker, with the help of his mentor Tony Stark, tries to balance his life as an ordinary high school student in Queens, New York City, with fighting crime as his superhero alter ego Spider-Man as a new threat, the Vulture, emerges."
tt22939186,,Arcadian,2024,92,6.3,778,"Action, Horror, Thriller",A father and his twin teenage sons fight to survive in a remote farmhouse at the end of the end of the world.
,568124,Encanto,2021,102,7.6,9119,"Animation, Comedy, Family, Fantasy","The tale of an extraordinary family, the Madrigals, who live hidden in the mountains of Colombia, in a magical house, in a vibrant town, in a wondrous, charmed place called an Encanto. The magic of the Encanto has blessed every child in the family—every child except one, Mirabel. But when she discovers that the magic surrounding the Encanto is in danger, Mirabel decides that she, the only ordinary Madrigal, might just be her exceptional family's last hope."
tt6166392,787699,Wonka,2023,116,7.1,139850,"Adventure, Comedy, Family, Comedy, Family, Fantasy","With dreams of opening a shop in a city renowned for its chocolate, a young and poor Willy Wonka discovers that the industry is run by a cartel of greedy chocolatiers."
,1046090,"The Pig, the Snake and the Pigeon",2023,134,7.3,147,"Action, Crime","The arrogant, third most-wanted criminal in Taiwan, decides to get rid of the top two competitors and crowns himself the most-wanted criminal before dying."
,890244,A Stalker in the House,2021,84,5.7,7,Thriller,"Jen is single and looking to find her match with online dating. She connects with Mike, who appears handsome and charming. But some things are too good to be true, and all is not what it seems. When he becomes aggressive Jen pushes away and tries to avoid him, however Mike has other ideas."
,984249,Ruthless,2023,93,6.3,53,"Action, Thriller","A high school coach, whose teenage daughter was murdered, takes matters into his own hands by going after the men who kidnap his students for their sex trafficking operation."
,1262596,Sweet Release,2024,101,4.5,1,Drama,"Ataska and Dyessa Garcia will take you to a hot and crazy roadtrip perfect for the summer season. Two girl bestfriends and a young man take on a a journey of self-discovery. Along the way, their bond deepens as they explore their sexual desires."
,206647,Spectre,2015,148,6.5,10189,"Action, Adventure, Thriller","A cryptic message from Bond’s past sends him on a trail to uncover a sinister organization. While M battles political forces to keep the secret service alive, Bond peels back the layers of deceit to reveal the terrible truth behind SPECTRE."
,661374,Glass Onion: A Knives Out Mystery,2022,140,7,5090,"Comedy, Crime, Mystery",World-famous detective Benoit Blanc heads to Greece to peel back the layers of a mystery surrounding a tech billionaire and his eclectic crew of friends.
,799155,Attack,2022,123,6.7,184,"Action, Science Fiction, Thriller","With the Parliament under siege, India’s first super soldier Arjun Shergill is tasked to get hold of the terrorists in the nick of time, save the Prime Minister from their clutches and stop a dirty bomb from exploding and destroying Delhi. Will Arjun succeed in his mission?"
,581726,Infinite,2021,106,6.6,1672,"Science Fiction, Action, Thriller","Evan McCauley has skills he never learned and memories of places he has never visited. Self-medicated and on the brink of a mental breakdown, a secret group that call themselves “Infinites” come to his rescue, revealing that his memories are real."
,49047,Gravity,2013,91,7.2,14879,"Science Fiction, Thriller, Drama","Dr. Ryan Stone, a brilliant medical engineer on her first Shuttle mission, with veteran astronaut Matt Kowalsky in command of his last flight before retiring. But on a seemingly routine spacewalk, disaster strikes. The Shuttle is destroyed, leaving Stone and Kowalsky completely alone-tethered to nothing but each other and spiraling out into the blackness of space. The deafening silence tells them they have lost any link to Earth and any chance for rescue. As fear turns to panic, every gulp of air eats away at what little oxygen is left. But the only way home may be to go further out into the terrifying expanse of space."
tt11304740,1022796,Wish,2023,95,6,32087,"Animation, Adventure, Comedy, Animation, Family, Fantasy, Adventure",A young girl named Asha wishes on a star and gets a more direct answer than she bargained for when a trouble-making star comes down from the sky to join her.
tt21188080,,Lisa Frankenstein,2024,101,6.1,13000,"Comedy, Horror, Romance","A coming of RAGE love story about a teenager and her crush, who happens to be a corpse. After a set of horrific circumstances bring him back to life, the two embark on a journey to find love, happiness - and a few missing body parts."
,370464,The Masked Saint,2016,111,4.8,38,"Crime, Action","The journey of a professional wrestler who becomes a small town pastor and moonlights as a masked vigilante fighting injustice. While facing crises at home and at the church, the Pastor must evade the police and somehow reconcile his violent secret identity with his calling as a pastor."
,14160,Up,2009,96,8,19551,"Animation, Comedy, Family, Adventure","Carl Fredricksen spent his entire life dreaming of exploring the globe and experiencing life to its fullest. But at age 78, life seems to have passed him by, until a twist of fate (and a persistent 8-year old Wilderness Explorer named Russell) gives him a new lease on life."
,297802,Aquaman,2018,143,6.9,13618,"Action, Adventure, Fantasy","Half-human, half-Atlantean Arthur Curry is taken on the journey of his lifetime to discover if he is worth of being a king."
,1071215,Thanksgiving,2023,106,6.6,860,"Horror, Mystery, Thriller","After a Black Friday riot ends in tragedy, a mysterious Thanksgiving-inspired killer terrorizes Plymouth, Massachusetts - the birthplace of the holiday. Picking off residents one by one, what begins as random revenge killings are soon revealed to be part of a larger, sinister holiday plan."
,141052,Justice League,2017,120,6.1,12602,"Action, Adventure, Science Fiction","Fuelled by his restored faith in humanity and inspired by Superman's selfless act, Bruce Wayne and Diana Prince assemble a team of metahumans consisting of Barry Allen, Arthur Curry and Victor Stone to face the catastrophic threat of Steppenwolf and the Parademons who are on the hunt for three Mother Boxes on Earth."
,585,"Monsters, Inc.",2001,92,7.8,17825,"Animation, Comedy, Family","Lovable Sulley and his wisecracking sidekick Mike Wazowski are the top scare team at Monsters, Inc., the scream-processing factory in Monstropolis. When a little girl named Boo wanders into their world, it's the monsters who are scared silly, and it's up to Sulley and Mike to keep her out of sight and get her back home."
Spider-Man: Into the Spider-Verse,2018,117,8.4,14923,"Animation, Action, Adventure, Science Fiction",\Struggling to find his place in the world while juggling school and family, Brooklyn teenager Miles Morales is unexpectedly bitten by a radioactive spider and develops unfathomable powers just like the one and only Spider-Man. While wrestling with the implications of his new abilities," Miles discovers a super collider created by the madman Wilson \""\""Kingpin\""\"" Fisk"""
Due Justice,2023,98,6.6,54,"Action, Mystery, Thriller, Crime",An attorney with a military past hunts down the gang who killed his wife and took his daughter.,,
tt0134119,,The Talented Mr. Ripley,1999,139,7.4,241000,"Crime, Drama, Thriller","In late 1950s New York, a young underachiever named Tom Ripley is sent to Italy to retrieve Dickie Greenleaf, a rich and spoiled millionaire playboy. But when the errand fails, Ripley takes extreme measures."
tt17351924,,Saltburn,2023,131,7,203000,"Drama, Thriller","A student at Oxford University finds himself drawn into the world of a charming and aristocratic classmate, who invites him to his eccentric family's sprawling estate for a summer never to be forgotten."
,537915,After,2019,106,7.1,8027,"Romance, Drama","Tessa Young is a dedicated student, dutiful daughter and loyal girlfriend to her high school sweetheart. Entering her first semester of college, Tessa's guarded world opens up when she meets Hardin Scott, a mysterious and brooding rebel who makes her question all she thought she knew about herself -- and what she wants out of life."
,1260916,A Journey,2024,115,9.2,5,Drama,"Refusing treatment for her cancer, a woman goes on a road trip across Tasmania to check off items on her bucket list with her husband and best friend."
,299534,Avengers: Endgame,2019,181,8.3,24766,"Adventure, Science Fiction, Action","After the devastating events of Avengers: Infinity War, the universe is in ruins due to the efforts of the Mad Titan, Thanos. With the help of remaining allies, the Avengers must assemble once more in order to undo Thanos' actions and restore order to the universe once and for all, no matter what consequences may be in store."
,1124127,Air Force One Down,2024,84,6.4,68,"Action, Thriller","On her first assignment aboard Air Force One, a rookie Secret Service agent faces the ultimate test when terrorists hijack the plane, intent on derailing a pivotal energy deal. With the President's life on the line and a global crisis at stake, her bravery and skills are pushed to the limit in a relentless battle that could change the course of history."
,490132,Green Book,2018,130,8.2,11099,"Drama, History","Tony Lip, a bouncer in 1962, is hired to drive pianist Don Shirley on a tour through the Deep South in the days when African Americans, forced to find alternate accommodations and services due to segregation laws below the Mason-Dixon Line, relied on a guide called The Negro Motorist Green Book."
,1074049,A Moroccan Affair,2023,97,6,44,Comedy,"Follows the Díaz-Aguirre family, whose perfect universe turns upside down after the death of the patriarch, who in his will asks his wife to recover the 'Sardinete', his first fishing boat which is rusting in a Moroccan port."
,497,The Green Mile,1999,189,8.5,16736,"Fantasy, Drama, Crime","A supernatural tale set on death row in a Southern prison, where gentle giant John Coffey possesses the mysterious power to heal people's ailments. When the cell block's head guard, Paul Edgecomb, recognizes Coffey's miraculous gift, he tries desperately to help stave off the condemned man's execution."
,14836,Coraline,2009,100,7.9,7466,"Animation, Family, Fantasy","A young girl discovers an idealized parallel universe behind a secret door in her new home, unaware that it contains a sinister secret."
,888003,The Book of Solutions,2023,102,6.1,204,"Comedy, Drama","Marc, a bipolar and paranoid filmmaker, cannot tolerate seeing his current project picked apart by his producers. The clips he’s been able to sneak a look at lead him to fear the worst. With his editor as an accomplice, he manages to spirit away the rushes to his aunt’s place in the Cévennes, to finish the film as he envisions it. Instead, its completion is constantly postponed, as he creates endless diversions and impasses, which alternate between the comic and the downright disturbing."
,2666,Dark City,1998,112,7.3,2658,"Mystery, Science Fiction","A man struggles with memories of his past, including a wife he cannot remember, in a nightmarish world with no sun and run by beings with telekinetic powers who seek the souls of humans."
,675353,Sonic the Hedgehog 2,2022,123,7.5,4666,"Action, Adventure, Family, Comedy","After settling in Green Hills, Sonic is eager to prove he has what it takes to be a true hero. His test comes when Dr. Robotnik returns, this time with a new partner, Knuckles, in search for an emerald that has the power to destroy civilizations. Sonic teams up with his own sidekick, Tails, and together they embark on a globe-trotting journey to find the emerald before it falls into the wrong hands."
,621,Grease,1978,110,7.4,6967,"Romance, Comedy","Australian good girl Sandy and greaser Danny fell in love over the summer. But when they unexpectedly discover they're now in the same high school, will they be able to rekindle their romance despite their eccentric friends?"
,1726,Iron Man,2008,126,7.6,25653,"Action, Science Fiction, Adventure","After being held captive in an Afghan cave, billionaire engineer Tony Stark creates a unique weaponized suit of armor to fight evil."
,766836,"Son's Girlfriend, Daddy's Girlfriend",2020,75,0,0,Romance,"Dong-gook, who is thinking of remarrying, introduces his stepmother Kyeong-sook to his son Jin-yeong. At the family gathering, Jin-yeong is surprised to see his stepmother's younger brother Hyeon-sook who was his one-night stand just a few days ago! Jin-yeong and his stepmother is lying down, drunk. Meanwhile, there is a strange atmosphere between Dong-gook and Hyeon-sook, who were drinking alone, and at that moment Jin-yeong's girlfriend Joo-yeon appears drunk."
,122,The Lord of the Rings: The Return of the King,2003,201,8.5,23293,"Adventure, Fantasy, Action","Aragorn is revealed as the heir to the ancient kings as he, Gandalf and the other members of the broken fellowship struggle to save Gondor from Sauron's forces. Meanwhile, Frodo and Sam take the ring closer to the heart of Mordor, the dark lord's realm."
,76341,Mad Max: Fury Road,2015,121,7.6,21588,"Action, Adventure, Science Fiction","An apocalyptic story set in the furthest reaches of our planet, in a stark desert landscape where humanity is broken, and most everyone is crazed fighting for the necessities of life. Within this world exist two rebels on the run who just might be able to restore order."
,807,Se7en,1995,127,8.4,20237,"Crime, Mystery, Thriller","\Two homicide detectives are on a desperate hunt for a serial killer whose crimes are based on the \""\""seven deadly sins\""\"" in this dark and haunting film that takes viewers from the tortured remains of one victim to the next. The seasoned Det. Sommerset researches each sin in an effort to get inside the killer's mind"""
tt3890160,,Baby Driver,2017,113,7.5,609000,"Action, Crime, Drama","After being coerced into working for a crime boss, a young getaway driver finds himself taking part in a heist doomed to fail."
,4935,Howl's Moving Castle,2004,119,8.4,9376,"Fantasy, Animation, Adventure","Sophie, a young milliner, is turned into an elderly woman by a witch who enters her shop and curses her. She encounters a wizard named Howl and gets caught up in his resistance to fighting for the king."
,19,Metropolis,1927,149,8.1,2586,"Drama, Science Fiction","In a futuristic city sharply divided between the rich and the poor, the son of the city's mastermind meets a prophet who predicts the coming of a savior to mediate their differences."
,129,Spirited Away,2001,125,8.5,15820,"Animation, Family, Fantasy","A young girl, Chihiro, becomes trapped in a strange new world of spirits. When her parents undergo a mysterious transformation, she must call upon the courage she never knew she had to free her family."
,856289,Creation of the Gods I: Kingdom of Storms,2023,148,6.8,203,"Action, Fantasy, War","Based on the most well-known classical fantasy novel of China, Fengshenyanyi, the trilogy is a magnificent eastern high fantasy epic that recreates the prolonged mythical wars between humans, immortals and monsters, which happened more than three thousand years ago."
,1019317,Stolen,2024,105,6.5,42,"Drama, Crime","A young woman struggles to defend her Sámi heritage in a world where xenophobia is on the rise, climate change is threatening reindeer herding, and young people choose suicide in the face of collective desperation."
,1865,Pirates of the Caribbean: On Stranger Tides,2011,137,6.5,13548,"Adventure, Action, Fantasy","Captain Jack Sparrow crosses paths with a woman from his past, and he's not sure if it's love -- or if she's a ruthless con artist who's using him to find the fabled Fountain of Youth. When she forces him aboard the Queen Anne's Revenge, the ship of the formidable pirate Blackbeard, Jack finds himself on an unexpected adventure in which he doesn't know who to fear more: Blackbeard or the woman from his past."
tt17279496,929590,Civil War,2024,109,7.5,21212,"Action, Thriller, Action, War, Science Fiction","A journey across a dystopian future America, following a team of military-embedded journalists as they race against time to reach DC before rebel factions descend upon the White House."
,673,Harry Potter and the Prisoner of Azkaban,2004,141,8,20826,"Adventure, Fantasy","Year three at Hogwarts means new fun and challenges as Harry learns the delicate art of approaching a Hippogriff, transforming shape-shifting Boggarts into hilarity and even turning back time. But the term also brings danger: soul-sucking Dementors hover over the school, an ally of the accursed He-Who-Cannot-Be-Named lurks within the castle walls, and fearsome wizard Sirius Black escapes Azkaban. And Harry will confront them all."
,61791,Rise of the Planet of the Apes,2011,105,7.3,11211,"Thriller, Action, Drama, Science Fiction","A highly intelligent chimpanzee named Caesar has been living a peaceful suburban life ever since he was born. But when he gets taken to a cruel primate facility, Caesar decides to revolt against those who have harmed him."
The OctoGames,2022,88,5.6,105,"Thriller, Action, Horror",\Eight contestants compete in eight deadly, classic children's games. They seek fame beyond their wildest dreams," competing for the chance to take over the YouTube channel of the famous yet elusive masked content creator known only as \""\""JaxPro\""\"".\"""""
tt11057302,634492,Madame Web,2024,116,4.7,54108,"Action, Adventure, Sci-Fi, Action, Fantasy","Cassandra Webb is a New York metropolis paramedic who begins to demonstrate signs of clairvoyance. Forced to challenge revelations about her past, she needs to safeguard three young women from a deadly adversary who wants them destroyed."
