IMDB_id,TMDB_id,Title,year,duration,Rating,Votes,Genres,Overview
,124905,Godzilla,2014,123,6.3,8781,"Action, Drama, Science Fiction","Ford Brody, a Navy bomb expert, has just reunited with his family in San Francisco when he is forced to go to Japan to help his estranged father, Joe. Soon, both men are swept up in an escalating crisis when an ancient alpha predator arises from the sea to combat malevolent adversaries that threaten the survival of humanity. The creatures leave colossal destruction in their wake, as they make their way toward their final battleground: San Francisco."
tt0111161,278,The Shawshank Redemption,1994,142,9,2926018,"Drama, Drama, Crime","Over the course of several years, two convicts form a friendship, seeking consolation and, eventually, redemption through basic compassion."
,667538,Transformers: Rise of the Beasts,2023,127,7.3,4204,"Action, Adventure, Science Fiction","When a new threat capable of destroying the entire planet emerges, Optimus Prime and the Autobots must team up with a powerful faction known as the Maximals. With the fate of humanity hanging in the balance, humans Noah and Elena will do whatever it takes to help the Transformers as they engage in the ultimate battle to save Earth."
,526896,Morbius,2022,105,6,4033,"Action, Science Fiction, Fantasy","Dangerously ill with a rare blood disorder, and determined to save others suffering his same fate, Dr. Michael Morbius attempts a desperate gamble. What at first appears to be a radical success soon reveals itself to be a remedy potentially worse than the disease."
,675,Harry Potter and the Order of the Phoenix,2007,138,7.7,18845,"Adventure, Fantasy","Returning for his fifth year of study at Hogwarts, Harry is stunned to find that his warnings about the return of Lord Voldemort have been ignored. Left with no choice, Harry takes matters into his own hands, training a small group of students to defend themselves against the dark arts."
,944401,Dogman,2023,115,7.8,704,"Action, Drama, Crime","A boy, bruised by life, finds his salvation through the love of his dogs."
tt0098206,,Road House,1989,114,6.7,99000,"Action, Thriller","A bouncer hired to clean up the baddest honkytonk in a Missouri town. Armed with a black belt in karate and a degree in philosophy, Patrick Swayze sets out to tame the Double Deuce for its owner."
,354912,Coco,2017,105,8.2,18717,"Family, Animation, Music, Adventure","Despite his family’s baffling generations-old ban on music, Miguel dreams of becoming an accomplished musician like his idol, Ernesto de la Cruz. Desperate to prove his talent, Miguel finds himself in the stunning and colorful Land of the Dead following a mysterious chain of events. Along the way, he meets charming trickster Hector, and together, they set off on an extraordinary journey to unlock the real story behind Miguel's family history."
,19995,Avatar,2009,162,7.6,30751,"Action, Adventure, Fantasy, Science Fiction","In the 22nd century, a paraplegic Marine is dispatched to the moon Pandora on a unique mission, but becomes torn between following orders and protecting an alien civilization."
tt0087182,841,Dune,1984,137,6.2,181794,"Action, Adventure, Sci-Fi, Action, Science Fiction, Adventure",A Duke's son leads desert warriors against the galactic emperor and his father's evil nemesis to free their desert world from the emperor's rule.
,11,Star Wars,1977,121,8.2,19881,"Adventure, Action, Science Fiction",Princess Leia is captured and held hostage by the evil Imperial forces in their effort to take over the galactic Empire. Venturesome Luke Skywalker and dashing captain Han Solo team together with the loveable robot duo R2-D2 and C-3PO to rescue the beautiful princess and restore peace and justice in the Empire.
,565770,Blue Beetle,2023,128,6.8,2321,"Action, Science Fiction, Adventure","Recent college grad Jaime Reyes returns home full of aspirations for his future, only to find that home is not quite as he left it. As he searches to find his purpose in the world, fate intervenes when Jaime unexpectedly finds himself in possession of an ancient relic of alien biotechnology: the Scarab."
,381288,Split,2017,117,7.3,16806,"Horror, Thriller","Though Kevin has evidenced 23 personalities to his trusted psychiatrist, Dr. Fletcher, there remains one still submerged who is set to materialize and dominate all the others. Compelled to abduct three teenage girls led by the willful, observant Casey, Kevin reaches a war for survival among all of those contained within him — as well as everyone around him — as the walls between his compartments shatter apart."
,575264,Mission: Impossible - Dead Reckoning Part One,2023,164,7.6,3338,"Action, Thriller","Ethan Hunt and his IMF team embark on their most dangerous mission yet: To track down a terrifying new weapon that threatens all of humanity before it falls into the wrong hands. With control of the future and the world's fate at stake and dark forces from Ethan's past closing in, a deadly race around the globe begins. Confronted by a mysterious, all-powerful enemy, Ethan must consider that nothing can matter more than his mission—not even the lives of those he cares about most."
,10198,The Princess and the Frog,2009,98,7.2,5316,"Animation, Romance, Fantasy, Family","A waitress, desperate to fulfill her dreams as a restaurant owner, is set on a journey to turn a frog prince back into a human being, but she has to face the same problem after she kisses him."
tt0087332,620,Ghostbusters,1984,105,7.6,457554,"Action, Comedy, Fantasy, Comedy, Fantasy","Three parapsychologists forced out of their university funding set up shop as a unique ghost removal service in New York City, attracting frightened yet skeptical customers."
,1134754,172 Days,2023,103,5.2,21,"Drama, Romance","Zira was united with Amer for 172 very memorable days. Fate separated, Amer left too soon, leaving many sweet memories for Zira."
,615777,Babylon,2022,189,7.4,2752,"Drama, Comedy","A tale of outsized ambition and outrageous excess, tracing the rise and fall of multiple characters in an era of unbridled decadence and depravity during Hollywood's transition from silent films to sound films in the late 1920s."
tt7160372,467244,The Zone of Interest,2023,105,7.4,79146,"Drama, History, War, History, Drama, War",Auschwitz commandant Rudolf Höss and his wife Hedwig strive to build a dream life for their family in a house and garden beside the camp.
,12445,Harry Potter and the Deathly Hallows: Part 2,2011,130,8.1,19897,"Fantasy, Adventure","Harry, Ron and Hermione continue their quest to vanquish the evil Voldemort once and for all. Just as things begin to look hopeless for the young wizards, Harry discovers a trio of magical objects that endow him with powers to rival Voldemort's formidable skills."
,282035,The Mummy,2017,110,5.5,6952,"Fantasy, Thriller, Action, Adventure, Horror","Though safely entombed in a crypt deep beneath the unforgiving desert, an ancient queen whose destiny was unjustly taken from her is awakened in our current day, bringing with her malevolence grown over millennia, and terrors that defy human comprehension."
,2062,Ratatouille,2007,111,7.8,16393,"Animation, Comedy, Family, Fantasy","Remy, a resident of Paris, appreciates good food and has quite a sophisticated palate. He would love to become a chef so he can create and enjoy culinary masterpieces to his heart's delight. The only problem is, Remy is a rat. When he winds up in the sewer beneath one of Paris' finest restaurants, the rodent gourmet finds himself ideally placed to realize his dream."
,869,Planet of the Apes,2001,120,5.7,3841,"Thriller, Science Fiction, Action, Adventure","After a spectacular crash-landing on an uncharted planet, brash astronaut Leo Davidson finds himself trapped in a savage world where talking apes dominate the human race. Desperate to find a way home, Leo must evade the invincible gorilla army led by Ruthless General Thade."
tt19853698,968441,Música,2024,91,6.6,2354,"Comedy, Music, Romance, Romance, Comedy, Music","A coming-of-age love story that follows an aspiring creator with synesthesia, who must come to terms with an uncertain future, while navigating the pressures of love, family, and his Brazilian culture in Newark, New Jersey."
,1027604,Princess Cursed in Time: Alchemist's Quest,2022,133,7.5,12,"Family, Fantasy, Comedy","It follows young alchemist Amélie as she acquires a magical power: partially influencing the flow of time. But she is split in time, and Amélie from the present meets Améliw from the past, who accompanies her every step of the way."
tt19864802,969492,Land of Bad,2024,113,6.9,16604,"Action, Thriller, Action, Thriller, War",A US Army special forces unit is ambushed during a mission to retrieve an intelligence asset and their only remaining hope lies with a remote Air Force drone operator assisting them through a brutal 48-hour battle for survival.
,127585,X-Men: Days of Future Past,2014,132,7.5,14820,"Action, Adventure, Science Fiction",The ultimate X-Men ensemble fights a war for the survival of the species across two time periods as they join forces with their younger selves in an epic battle that must change the past – to save our future.
tt21192142,,All of Us Strangers,2023,105,7.7,42000,"Drama, Fantasy, Romance",A screenwriter drawn back to his childhood home enters into a fledgling relationship with his downstairs neighbor while discovering a mysterious new way to heal from losing his parents 30 years ago.
,1700,Misery,1990,107,7.8,4398,"Drama, Thriller","After stalking and saving the life of her favorite fiction author in a car accident, his  manic obsessor holds him captive in her remote Colorado home then forces him to write back to life the popular literary character he killed off."
,16320,Serenity,2005,119,7.4,3329,"Science Fiction, Action, Adventure, Thriller","When the renegade crew of Serenity agrees to hide a fugitive on their ship, they find themselves in an action-packed battle between the relentless military might of a totalitarian regime who will destroy anything – or anyone – to get the girl back and the bloodthirsty creatures who roam the uncharted areas of space. But... the greatest danger of all may be on their ship."
,849509,Jade,2024,0,6,20,"Action, Thriller","Jade presents the story of a woman who comes between a powerful businessman and a gang leader in their search for a hard drive that could damage the operations of Interpol. Despite grieving for the brother she accidentally killed, the woman is required to use her unique set of skills to retrieve the drive and protect her brother's unborn child being carried by another woman."
tt17009710,915935,Anatomy of a Fall,2023,151,7.7,117811,"Crime, Drama, Thriller, Thriller, Mystery, Crime",A woman is suspected of murder after her husband's death; their half-blind son faces a moral dilemma as the main witness.
,893723,PAW Patrol: The Mighty Movie,2023,92,7.1,377,"Animation, Family, Action, Science Fiction, Comedy, Drama, Adventure","A magical meteor crash lands in Adventure City and gives the PAW Patrol pups superpowers, transforming them into The Mighty Pups."
,337404,Cruella,2021,134,8,8951,"Comedy, Crime","In 1970s London amidst the punk rock revolution, a young grifter named Estella is determined to make a name for herself with her designs. She befriends a pair of young thieves who appreciate her appetite for mischief, and together they are able to build a life for themselves on the London streets. One day, Estella’s flair for fashion catches the eye of the Baroness von Hellman, a fashion legend who is devastatingly chic and terrifyingly haute. But their relationship sets in motion a course of events and revelations that will cause Estella to embrace her wicked side and become the raucous, fashionable and revenge-bent Cruella."
,1209770,Bedspacer,2024,106,3.9,8,"Thriller, Drama",Janice's steamy obsession to imitate Lexi propels them to campus stardom. But dark secrets blur the lines between authenticity and seductive deception.
tt14849194,,The Holdovers,2023,133,7.9,135000,"Comedy, Drama",A cranky history teacher at a prep school is forced to remain on campus over the holidays with a grieving cook and a troubled student who has no place to go.
tt1684562,746036,The Fall Guy,2024,126,7.2,670,"Action, Comedy, Drama, Action, Comedy, Adventure",A down-and-out stuntman must find the missing star of his ex-girlfriend's blockbuster film.
,11688,The Emperor's New Groove,2000,78,7.6,6404,"Adventure, Animation, Comedy, Family, Fantasy","Kuzco is a self-centered emperor who summons Pacha from a village and to tell him that his home will be destroyed to make room for Kuzco's new summer home. Kuzco's advisor, Yzma, tries to poison Kuzco and accidentally turns him into a llama, who accidentally ends up in Pacha's village. Pacha offers to help Kuzco if he doesn't destroy his house, and so they form an unlikely partnership."
,346364,It,2017,135,7.2,18523,Horror,"In a small town in Maine, seven children known as The Losers Club come face to face with life problems, bullies and a monster that takes the shape of a clown called Pennywise."
,260514,Cars 3,2017,102,6.9,5520,"Family, Animation, Adventure, Comedy","Blindsided by a new generation of blazing-fast racers, the legendary Lightning McQueen is suddenly pushed out of the sport he loves. To get back in the game, he will need the help of an eager young race technician with her own plan to win, inspiration from the late Fabulous Hudson Hornet, and a few unexpected turns. Proving that #95 isn't through yet will test the heart of a champion on Piston Cup Racing’s biggest stage!"
,748783,The Garfield Movie,2024,101,0,0,"Animation, Comedy, Family","Garfield, the world-famous, Monday-hating, lasagna-loving indoor cat, is about to have a wild outdoor adventure! After an unexpected reunion with his long-lost father – scruffy street cat Vic – Garfield and his canine friend Odie are forced from their perfectly pampered life into joining Vic in a hilarious, high-stakes heist."
tt15009428,848538,Argylle,2024,139,5.9,57906,"Action, Comedy, Thriller, Action, Adventure, Comedy","A reclusive author who writes espionage novels about a secret agent and a global spy syndicate realizes the plot of the new book she's writing starts to mirror real-world events, in real time."
,848187,Role Play,2024,101,6.1,438,"Action, Comedy, Romance",Emma has a wonderful husband and two kids in the suburbs of New Jersey – she also has a secret life as an assassin for hire – a secret that her husband David discovers when the couple decide to spice up their marriage with a little role play.
,1239251,Megamind vs. the Doom Syndicate,2024,85,5.2,57,"Animation, Comedy, Science Fiction","Megamind's former villain team, The Doom Syndicate, has returned. Our newly crowned blue hero must now keep up evil appearances until he can assemble his friends (Roxanne, Ol' Chum and Keiko) to stop his former evil teammates from launching Metro City to the Moon."
,885303,The Voyagers,2022,108,5.6,44,"Fantasy, Adventure, TV Movie",Time jump to 1939 with teenager Max and his friends as they try to navigate Mussolini's Rome and find Max's missing brother.
tt13452446,763215,Damsel,2024,110,6.6,77621,"Action, Adventure, Fantasy, Fantasy, Action, Adventure","A dutiful damsel agrees to marry a handsome prince, only to find the royal family has recruited her as a sacrifice to repay an ancient debt."
,948,Halloween,1978,91,7.6,5299,"Horror, Thriller","Fifteen years after murdering his sister on Halloween Night 1963, Michael Myers escapes from a mental hospital and returns to the small town of Haddonfield, Illinois to kill again."
tt15398776,872585,Oppenheimer,2023,180,8.2,726711,"Biography, Drama, History, Drama, History",The story of American scientist J. Robert Oppenheimer and his role in the development of the atomic bomb.
,86493,She Devils of the SS,1973,95,4.8,49,"Drama, War","In the last days of WW2, women are volunteering from all over Germany to serve in the front lines by having sex with the brave Nazi soldiers. But when they start having sex with each other, things get complicated. Especially with the increasing danger from the revengeful Soviet army!"
,949429,The Adventures,2023,143,6.5,19,"Romance, Comedy, Adventure","Joy, a secretary at a large multinational company, has an online shopping problem, likes to read adventure novels and watch travel and adventure shows. She daydreams about living a life of adventure."
,1248795,Art of Love,2024,99,6.6,94,"Romance, Action, Drama","After learning that the art thief she has been chasing is her ex-lover, an officer working for Interpol concocts a plan to catch him red-handed."
,177572,Big Hero 6,2014,102,7.7,15147,"Adventure, Family, Animation, Action, Comedy","A special bond develops between plus-sized inflatable robot Baymax, and prodigy Hiro Hamada, who team up with a group of friends to form a band of high-tech heroes."
,933131,Badland Hunters,2024,107,6.8,586,"Science Fiction, Action","After a deadly earthquake turns Seoul into a lawless badland, a fearless huntsman springs into action to rescue a teenager abducted by a mad doctor."
,320288,Dark Phoenix,2019,114,6,6200,"Science Fiction, Action, Adventure","The X-Men face their most formidable and powerful foe when one of their own, Jean Grey, starts to spiral out of control. During a rescue mission in outer space, Jean is nearly killed when she's hit by a mysterious cosmic force. Once she returns home, this force not only makes her infinitely more powerful, but far more unstable. The X-Men must now band together to save her soul and battle aliens that want to use Grey's new abilities to rule the galaxy."
,140300,Kung Fu Panda 3,2016,95,6.9,5720,"Action, Adventure, Animation, Comedy, Family","While Po and his father are visiting a secret panda village, an evil spirit threatens all of China, forcing Po to form a ragtag army to fight back."
,414906,The Batman,2022,177,7.7,9457,"Crime, Mystery, Thriller","In his second year of fighting crime, Batman uncovers corruption in Gotham City that connects to his own family while facing a serial killer known as the Riddler."
,38757,Tangled,2010,100,7.6,11001,"Animation, Family","When the kingdom's most wanted-and most charming-bandit Flynn Rider hides out in a mysterious tower, he's taken hostage by Rapunzel, a beautiful and feisty tower-bound teen with 70 feet of magical, golden hair. Flynn's curious captor, who's looking for her ticket out of the tower where she's been locked away for years, strikes a deal with the handsome thief and the unlikely duo sets off on an action-packed escapade, complete with a super-cop horse, an over-protective chameleon and a gruff gang of pub thugs."
,615656,Meg 2: The Trench,2023,116,6.6,3068,"Action, Science Fiction, Horror",An exploratory dive into the deepest depths of the ocean of a daring research team spirals into chaos when a malevolent mining operation threatens their mission and forces them into a high-stakes battle for survival.
,284054,Black Panther,2018,135,7.4,21592,"Action, Adventure, Science Fiction","King T'Challa returns home to the reclusive, technologically advanced African nation of Wakanda to serve as his country's new leader. However, T'Challa soon finds that he is challenged for the throne by factions within his own country as well as without. Using powers reserved to Wakandan kings, T'Challa assumes the Black Panther mantle to join with ex-girlfriend Nakia, the queen-mother, his princess-kid sister, members of the Dora Milaje (the Wakandan 'special forces') and an American secret agent, to prevent Wakanda from being dragged into a world war."
,284053,Thor: Ragnarok,2017,131,7.6,20120,"Action, Adventure, Science Fiction","Thor is imprisoned on the other side of the universe and finds himself in a race against time to get back to Asgard to stop Ragnarok, the destruction of his home-world and the end of Asgardian civilization, at the hands of a powerful new threat, the ruthless Hela."
,11674,101 Dalmatians,1996,103,5.9,3261,"Family, Comedy","An evil, high-fashion designer plots to steal Dalmatian puppies in order to make an extravagant fur coat, but instead creates an extravagant mess."
tt14030816,845783,Baghead,2023,94,6.1,4726,"Horror, Horror, Thriller","A young woman inherits a run-down pub and discovers a dark secret within its basement - Baghead - a shape-shifting creature that will let you speak to lost loved ones, but not without consequence."
,5548,RoboCop,1987,102,7.3,4850,"Action, Thriller, Science Fiction","In a violent, near-apocalyptic Detroit, evil corporation Omni Consumer Products wins a contract from the city government to privatize the police force. To test their crime-eradicating cyborgs, the company leads street cop Alex Murphy into an armed confrontation with crime lord Boddicker so they can use his body to support their untested RoboCop prototype. But when RoboCop learns of the company's nefarious plans, he turns on his masters."
,323260,The Gigolo,2015,97,4.6,23,"Romance, Drama, Comedy","Fung looks like a super-heartthrob and was bon with a special endowment, making him the high school idol. He was expelled from school when he was caught fighting on campus. When his mom, the sole provider of his family with her poultry business, had to stop working due to her back problems, Fung decides to support his family financially. And from that moment, his life takes on a tumultuous change…"
tt23289160,940721,Godzilla Minus One,2023,124,8.1,48488,"Action, Adventure, Drama, Science Fiction, Horror, Action","Post war Japan is at its lowest point when a new crisis emerges in the form of a giant monster, baptized in the horrific power of the atomic bomb."
tt23137390,1041613,Immaculate,2024,89,6.2,11182,"Horror, Horror, Mystery, Thriller","Cecilia, a woman of devout faith, is warmly welcomed to the picture-perfect Italian countryside where she is offered a new role at an illustrious convent. But it becomes clear to Cecilia that her new home harbors dark and horrifying secrets."
,502356,The Super Mario Bros. Movie,2023,93,7.7,8319,"Animation, Family, Adventure, Fantasy, Comedy","While working underground to fix a water main, Brooklyn plumbers—and brothers—Mario and Luigi are transported down a mysterious pipe and wander into a magical new world. But when the brothers are separated, Mario embarks on an epic quest to find Luigi."
,198184,Chappie,2015,120,6.8,7656,"Crime, Action, Science Fiction","Every child comes into the world full of promise, and none more so than Chappie: he is gifted, special, a prodigy. Like any child, Chappie will come under the influence of his surroundings—some good, some bad—and he will rely on his heart and soul to find his way in the world and become his own man. But there's one thing that makes Chappie different from any one else: he is a robot."
,980489,Gran Turismo,2023,135,7.9,2301,"Adventure, Action, Drama",The ultimate wish-fulfillment tale of a teenage Gran Turismo player whose gaming skills won him a series of Nissan competitions to become an actual professional racecar driver.
,12153,White Chicks,2004,109,7,3738,"Comedy, Crime","Two FBI agent brothers, Marcus and Kevin Copeland, accidentally foil a drug bust. To avoid being fired they accept a mission escorting a pair of socialites to the Hamptons--but when the girls are disfigured in a car accident, they refuse to go. Left without options, Marcus and Kevin decide to pose as the sisters, transforming themselves from black men into rich white women."
,287947,Shazam!,2019,132,7,9165,"Action, Comedy, Fantasy",A boy is given the ability to become an adult superhero in times of need with a single magic word.
tt8542964,978592,Sleeping Dogs,2024,110,6.2,3252,"Crime, Mystery, Thriller, Drama, Thriller, Mystery","An ex-homicide detective with memory loss is forced to solve a brutal murder, only to uncover chilling secrets from his forgotten past."
,447277,The Little Mermaid,2023,135,6.4,2709,"Adventure, Family, Fantasy, Romance","The youngest of King Triton’s daughters, and the most defiant, Ariel longs to find out more about the world beyond the sea, and while visiting the surface, falls for the dashing Prince Eric. With mermaids forbidden to interact with humans, Ariel makes a deal with the evil sea witch, Ursula, which gives her a chance to experience life on land, but ultimately places her life – and her father’s crown – in jeopardy."
,109445,Frozen,2013,102,7.2,16021,"Animation, Family, Adventure, Fantasy","Young princess Anna of Arendelle dreams about finding true love at her sister Elsa’s coronation. Fate takes her on a dangerous journey in an attempt to end the eternal winter that has fallen over the kingdom. She's accompanied by ice delivery man Kristoff, his reindeer Sven, and snowman Olaf. On an adventure where she will find out what friendship, courage, family, and true love really means."
,635,Angel Heart,1987,113,7.1,1438,"Horror, Mystery","Harry Angel, a down-and-out Brooklyn detective, is hired to track down a singer on an odyssey that will take him through the desperate streets of Harlem, the smoke-filled jazz clubs of New Orleans, and the swamps of Louisiana and its seedy underworld of voodoo."
tt10869778,,Maidaan,2024,181,8.8,12000,"Biography, Drama, History","Inspired by the Indian national football team coach and manager Syed Abdul Rahim, who is regarded as the architect of Indian football."
,1241748,Kalikot,2024,49,7,4,"Drama, Romance","Sal, a hot single professor, moves across an auto service shop and rocks the world of young repairman Arnel. Ever since Sal came over to get her car fixed, Arnel's skilled hands have always been busy. But can he still fix the problems that come with it?"
